qid,question,answer_with_context,model
q_576,Beyonce would perform with who at Superbowl 50?,Coldplay,llama3-8b-8192
q_577,Beyonce took home how many awards at the 57th Grammy Awards?,Three,llama3-8b-8192
q_578,Beyonce lost to which artist for Album of the year?,Taylor Swift,llama3-8b-8192
q_579,Who did Beyonce perform next to during Superbowl 50?,UNKNOWN,llama3-8b-8192
q_58,What did the brother of John Zahm construct at Notre Dame?,An early wind tunnel,llama3-8b-8192
q_580,"If Beyonce won three Grammies in 2015, how many was she nominated for?",Six,llama3-8b-8192
q_581,On what magazine was she the cover model?,L'Officiel and Vogue,llama3-8b-8192
q_582,Who would she perform with at Superbowl 50?,Coldplay,llama3-8b-8192
q_583,With what British band did Beyonce perform on their album?,Coldplay,llama3-8b-8192
q_584,How many awards was Beyoncé nominated for at the 57th annual Grammys?,Six,llama3-8b-8192
q_585,How many awards did Beyoncé win at the 57th Annual Grammys?,Three,llama3-8b-8192
q_586,Beyoncé lost the Album of the Year award to which entertainer?,UNKNOWN,llama3-8b-8192
q_587,"Which magazine did Beyoncé pose for the cover, making her the first black female artist to do so?",Forbes,llama3-8b-8192
q_588,Who did Beyonce perform with at Super Bowl 50?,Coldplay,llama3-8b-8192
q_589,"Beyonce released the song ""Formation"" on which online music service?",Tidal,llama3-8b-8192
q_59,Work on a germ-free-life ended up in the creation of which Notre Dame institute?,UNKNOWN,llama3-8b-8192
q_590,Beyonce's new single released before the super bowl was called what?,Formation,llama3-8b-8192
q_591,"What day did Beyonce release her single, Formation?","February 6, 2016",llama3-8b-8192
q_592,How was the single released?,exclusively on music streaming service Tidal,llama3-8b-8192
q_593,What was the name of the streaming service?,Tidal,llama3-8b-8192
q_594,What kind of platform was the song released?,Jay Z's website Lifeandtimes,llama3-8b-8192
q_595,When did Beyoncé release Formation?,"February 6, 2016",llama3-8b-8192
q_596,"Where did Beyoncé exclusively release her single, Formation?",Tidal,llama3-8b-8192
q_597,"As of April 2014, how many albums have Jay Z and Beyonce sold together?",300 million,llama3-8b-8192
q_598,Where did Beyonce become pregnant?,Paris,llama3-8b-8192
q_599,"Beyonce described what as the ""hardest thing she had to endure""?",the saddest thing,llama3-8b-8192
q_6,How often is Notre Dame's the Juggler published?,Twice a year,llama3-8b-8192
q_60,Around what time did Lobund of Notre Dame become independent?,The 1940s,llama3-8b-8192
q_600,Who did Beyonce have a relationship with?,Jay Z,llama3-8b-8192
q_601,When were Beyonce and Jay Z married?,"April 4, 2008",llama3-8b-8192
q_602,Together how records have they sold ?,300 million,llama3-8b-8192
q_603,How did Beyonce deal with the miscarriage of her child?,"The song ""Glory"" detailed the couple's pregnancy struggles, including a miscarriage Beyoncé suffered before becoming pregnant with Blue Ivy",llama3-8b-8192
q_604,Where was Beyonce when she became pregnant?,Paris,llama3-8b-8192
q_605,"In which music video did Beyoncé star as Jay Z's girlfriend, creating speculation about their relationship?",03 Bonnie & Clyde,llama3-8b-8192
q_606,When were Beyoncé and Jay Z married?,"April 4, 2008",llama3-8b-8192
q_607,How many records combined have Beyoncé and Jay Z sold?,300 million,llama3-8b-8192
q_608,What did Beyoncé describe as the saddest thing in her life?,the saddest thing,llama3-8b-8192
q_609,Where did Beyoncé get pregnant?,Paris,llama3-8b-8192
q_61,In what year did Lobund at Notre Dame become an Institute?,1950,llama3-8b-8192
q_610,Jay Z and Beyonce attended which event together in August of 2011?,2011 MTV Video Music Awards,llama3-8b-8192
q_611,Beyonce confirmed what after performing one of her songs?,Her pregnancy,llama3-8b-8192
q_612,How many people watched the 2011 MTV Music Awards?,12,llama3-8b-8192
q_613,Where did she announce her pregnancy?,At the 2011 MTV Video Music Awards,llama3-8b-8192
q_614,Why was the broadcast the most-watched in history?,UNKNOWN,llama3-8b-8192
q_615,What even was recorded in the Guinness World Records?,most tweets per second recorded for a single event,llama3-8b-8192
q_616,"What was the most searched term in week of Aug 29, 2011?",Beyonce pregnant,llama3-8b-8192
q_617,What song did she perform at the MTV Awards?,Love on Top,llama3-8b-8192
q_618,Where did Beyoncé announce her pregnancy?,At the 2011 MTV Video Music Awards,llama3-8b-8192
q_619,What song did Beyoncé sing prior to announcing her pregnancy?,Love on Top,llama3-8b-8192
q_62,The Lobund Institute was merged into the Department of Biology at Notre Dame in what year?,1958,llama3-8b-8192
q_620,How many people watched the 2011 MTV Video Music Awards?,12,llama3-8b-8192
q_621,"What was the most searched term on Google for the week of August 29, 2011?",Beyonce pregnant,llama3-8b-8192
q_622,Jay Z has a website called what?,Lifeandtimes,llama3-8b-8192
q_623,Which song by Jay Z talked about the pregnancy struggles?,Glory,llama3-8b-8192
q_624,What was the name of Beyonce's daughter?,Blue Ivy Carter,llama3-8b-8192
q_625,At what hospital was the baby delivered?,Lenox Hill Hospital in New York,llama3-8b-8192
q_626,What was the named of the song dedicated to the child?,Glory,llama3-8b-8192
q_627,What does B.I.C. stand for?,UNKNOWN,llama3-8b-8192
q_628,Who was credited for her cries on the song?,Blue Ivy Carter,llama3-8b-8192
q_629,When did Beyoncé give birth to her daughter?,"January 7, 2012",llama3-8b-8192
q_63,When did study of a germ-free-life begin at Notre Dame?,UNKNOWN,llama3-8b-8192
q_630,What did Beyoncé and Jay Z name their daughter?,Blue Ivy Carter,llama3-8b-8192
q_631,What song did Jay Z release two days after Blue Ivy was born?,Glory,llama3-8b-8192
q_632,What is included at the end of Glory?,Blue Ivy's cries,llama3-8b-8192
q_633,How was Blue Ivy credited on Glory?,B,llama3-8b-8192
q_634,Beyonce and Jay-Z went to a rally for the acquittal of whom?,George Zimmerman for the shooting of Trayvon Martin,llama3-8b-8192
q_635,Beyonce sang which song during the 2009 presidential inauguration?,America the Beautiful,llama3-8b-8192
q_636,How much did Beyonce raise for Obama at the 40/40 Club?,$4 million,llama3-8b-8192
q_637,"What did she endorse on March 26, 2013?",Same sex marriage,llama3-8b-8192
q_638,What did they attend in July 2013?,Notre Dame's conference affiliations for all of its sports except football and fencing changed,llama3-8b-8192
q_639,What did she sing at the 2009 Presidential Inauguration?,"America the Beautiful"" and ""At Last",llama3-8b-8192
q_64,Gurian created what in 1939 at Notre Dame?,The Review of Politics,llama3-8b-8192
q_640,What song did Beyoncé perform at the 2009 inauguration of Obama?,"America the Beautiful"" and ""At Last",llama3-8b-8192
q_641,What song did Beyoncé perform at the first inaugural dance for the Obamas.,At Last,llama3-8b-8192
q_642,What social media platform did Beyoncé upload a picture of her paper ballot on?,Tumblr,llama3-8b-8192
q_643,"When did Beyoncé endorse on March 26, 2013?",same sex marriage,llama3-8b-8192
q_644,Beyonce did an interview with which magazine and was asked about feminism?,Vogue,llama3-8b-8192
q_645,Beyonce supported which campaign that encourages leadership in girls?,The Ban Bossy campaign,llama3-8b-8192
q_646,Where was Beyonce quoted as saying that she is a modern-day feminist?,UNKNOWN,llama3-8b-8192
q_647,When did she say the she is a feminist?,April 2013,llama3-8b-8192
q_648,What campaign did she contribute to?,Ban Bossy campaign,llama3-8b-8192
q_649,What song did she release in 2013 in response to a speech?,Flawless,llama3-8b-8192
q_65,What was the Review of Politics inspired by?,German Catholic journals,llama3-8b-8192
q_650,What does Ban Bossy encourage?,leadership in girls,llama3-8b-8192
q_651,"Beyoncé used words from which Nigerian author in her song, Flawless?",Chimamanda Ngozi Adichie,llama3-8b-8192
q_652,Which campaign does Beyoncé contribute to that encourages leadership in females?,Ban Bossy campaign,llama3-8b-8192
q_653,Beyonce signed a letter with who in 2015?,Angela Merkel and Nkosazana Dlamini-Zuma,llama3-8b-8192
q_654,An important UN summit took place when?,September 2015,llama3-8b-8192
q_655,The letter Beyonce signed focused on what issue?,women,llama3-8b-8192
q_656,What had to be set in developing funding?,Priorities in development funding,llama3-8b-8192
q_657,When did Beyonce sign a letter for ONE Campaign?,2015,llama3-8b-8192
q_658,To whom was the letter addressed?,Angela Merkel and Nkosazana Dlamini-Zuma,llama3-8b-8192
q_659,Who are these women?,"Mary Ann Proctor, Angela Sienko, Beyoncé, Tina",llama3-8b-8192
q_66,Over how many years did Gurian edit the Review of Politics at Notre Dame?,44,llama3-8b-8192
q_660,When will they meet?,UNKNOWN,llama3-8b-8192
q_661,Who did Beyoncé sign a letter for in 2015?,Angela Merkel and Nkosazana Dlamini-Zuma,llama3-8b-8192
q_662,Who was the letter addressed to?,Angela Merkel and Nkosazana Dlamini-Zuma,llama3-8b-8192
q_663,What was Angela Merkel serving as in relation to the letter?,head of the G7 in Germany,llama3-8b-8192
q_664,What did the letter want the two recipients to focus on?,women,llama3-8b-8192
q_665,Beyonce along with Jay Z met with whom's family after their death?,Freddie Gray,llama3-8b-8192
q_666,Beyonce with Jay Z gave lots of money to bail who out of prison?,Protesters of Freddie Gray's death,llama3-8b-8192
q_667,Who's death caused this protest?,Freddie Gray,llama3-8b-8192
q_668,How much bail money did they spend?,Thousands of dollars,llama3-8b-8192
q_669,Beyonce beat out which musical artists for most paid between June 2007 and June 2008?,Madonna and Celine Dion,llama3-8b-8192
q_67,Thomas Stritch was an editor of which publican from Notre Dame?,The Review of Politics,llama3-8b-8192
q_670,Beyonce and Jay Z got a Guinness World record for what in 2009?,highest-earning power couple,llama3-8b-8192
q_671,Beyonce became the highest-paid black musician in which year?,UNKNOWN,llama3-8b-8192
q_672,"Up until May of 2015, how much is Beyonce's total worth?",$250 million,llama3-8b-8192
q_673,"Between 2008 and 2009, which entertainers did Beyonce beat in earnings?",Madonna and Celine Dion,llama3-8b-8192
q_674,In 2012 who placed Beyonce at 16 in the Celebrity List?,Forbes,llama3-8b-8192
q_675,When did she and Jay Z become the highest paid black celebrity couple?,April 2013,llama3-8b-8192
q_676,How much did she earn in 2014?,$115 million,llama3-8b-8192
q_677,What is Beyonce's net worth in 2015?,$250 million,llama3-8b-8192
q_678,"Who began reporting Beyoncé's annual earnings, starting in 2008?",Forbes magazine,llama3-8b-8192
q_679,"When did Beyoncé become the highest paid black musician, ever?",April 2014,llama3-8b-8192
q_68,Who was the president of Notre Dame in 2012?,John Jenkins,llama3-8b-8192
q_680,Who predicted that Beyoncé would become the highest paid black entertainer?,MTV,llama3-8b-8192
q_681,When did Jay Z and Beyoncé become the first music couple worth over a billion dollars?,2013,llama3-8b-8192
q_682,Beyonce's range in singing is how many octaves?,Four octaves,llama3-8b-8192
q_683,who talked about Beyonce's tone and timbre as distinctive?,Jody Rosen,llama3-8b-8192
q_684,"Which critic called Beyonce's voice ""versatile""?",The Daily Mail,llama3-8b-8192
q_685,Which era was credited to have influenced Beyonce's singing style by Jody Rosen?,hip hop era,llama3-8b-8192
q_686,How many octaves does Beyonce have?,Four octaves,llama3-8b-8192
q_687,What did the Daily Mail say about Beyonce's voice?,"versatile"", capable of exploring power ballads, soul, rock belting, operatic flourishes, and hip hop",llama3-8b-8192
q_688,What does Rosen claim influenced Beyonce's style?,hip hop era,llama3-8b-8192
q_689,What do other critics claim?,White celebrities who dress similarly do not attract as many comments,llama3-8b-8192
q_69,The Kellogg Institute for International Studies is part of which university?,University of Notre Dame,llama3-8b-8192
q_690,How many octaves does Beyoncé's voice span?,Four octaves,llama3-8b-8192
q_691,Why is Beyoncé known as the centerpiece of Destiny's Child?,Her vocal abilities,llama3-8b-8192
q_692,New York Times' Jon Pareles calls Beyoncé's voice velvety yet what?,"tart, with an insistent flutter and reserves of soul belting",llama3-8b-8192
q_693,What does Jody Rosen say influenced Beyoncé's vocal style?,"The hip hop era highly influenced Beyoncé's strange rhythmic vocal style, but also finds her quite traditionalist in her use of balladry, gospel and falsetto",llama3-8b-8192
q_694,Music from Beyonce is generally categorized as what genre?,R&B,llama3-8b-8192
q_695,"Besides R&B, which genres does Beyonce dabble in?","1990s R&B, Earth, Wind & Fire, DeBarge, Lionel Richie, Teena Marie, The Jackson 5, New Edition, Adele, Florence and the Machine, and Prince",llama3-8b-8192
q_696,"Beyonce mostly releases English songs, but what other language did she release songs?",Spanish,llama3-8b-8192
q_697,Spanish songs Beyonce released were for what?,Irreemplazable and the re-release of B'Day,llama3-8b-8192
q_698,Beyonce was coached for her Spanish songs by which American?,Rudy Perez,llama3-8b-8192
q_699,What kind of music does Beyonce do?,Pop,llama3-8b-8192
q_7,What is the daily student paper at Notre Dame called?,The Observer,llama3-8b-8192
q_70,What does the Kroc Institute at Notre Dame focus on?,The causes of violent conflict and the conditions for sustainable peace,llama3-8b-8192
q_700,What language does she mainly sing?,English,llama3-8b-8192
q_701,What other language has she sung?,Spanish,llama3-8b-8192
q_702,What album did she re-release in Spanish?,UNKNOWN,llama3-8b-8192
q_703,What style of music does Beyoncé usually perform?,R&B,llama3-8b-8192
q_704,What language did Beyoncé release several songs in?,Spanish,llama3-8b-8192
q_705,Who coached Beyoncé for her Spanish recordings?,Rudy Perez,llama3-8b-8192
q_706,What album did the Spanish songs come from?,Irreemplazable and the re-release of B'Day,llama3-8b-8192
q_707,Beyonce does not create which aspect of her music?,Lossless audio,llama3-8b-8192
q_708,An example of a song aimed towards a male audience is what?,UNKNOWN,llama3-8b-8192
q_709,What theme was Beyonce's early music?,female-empowerment themed compositions,llama3-8b-8192
q_71,In what year did Notre Dame begin to host the Global Adaptation Index?,2013,llama3-8b-8192
q_710,With Jay Z what were her new themes?,man-tending anthems,llama3-8b-8192
q_711,What does she get credits for in her music?,co-writing credits and co-producing credits,llama3-8b-8192
q_712,What part of production does she do?,"She typically comes up with melodies and ideas during production, sharing them with producers",llama3-8b-8192
q_713,Beyoncé's early recordings empowered who?,female,llama3-8b-8192
q_714,"In addition to co-writing credits, Beyoncé also got what credits for most of her albums?",Executive producer credits,llama3-8b-8192
q_715,"Rather than beats, what two things does Beyoncé usually come up with for producers?",melodies and ideas,llama3-8b-8192
q_716,Pop Songwriter of the Year award in 2001 was awarded to whom?,Beyoncé,llama3-8b-8192
q_717,Beyonce received the Pop Songwriter of the Year award at which event?,"American Society of Composers, Authors, and Publishers Pop Music Awards",llama3-8b-8192
q_718,Beyonce has the same number of writing credits on number one singles as whom?,Diane Warren,llama3-8b-8192
q_719,Beyonce joined 2 other women on what list from Billboard magazine in 2011?,Top 20 Hot 100 Songwriters,llama3-8b-8192
q_72,What threat does the Global Adaptation Index study?,Climate change,llama3-8b-8192
q_720,When did Beyonce become the first African American woman to win Pop songwriter of the year?,2001,llama3-8b-8192
q_721,What place is she tied for in songwriting credits?,Third,llama3-8b-8192
q_722,Who listed her at number 17 in their list of Top 20 hot 100 Songwriters?,Billboard magazine,llama3-8b-8192
q_723,Where does she place in writing credits for three number one songs?,Third woman,llama3-8b-8192
q_724,"What did Beyoncé win in 2001, making her the first black woman to do so?","Pop Songwriter of the Year award at the American Society of Composers, Authors, and Publishers Pop Music Awards",llama3-8b-8192
q_725,Who gave Beyoncé the Pop Songwriter of the Year award in 2001?,"American Society of Composers, Authors, and Publishers",llama3-8b-8192
q_726,"Beyoncé was one of how many women on Billboard magazine's 2011 ""Top 20 Hot 100 Songwriters"" list.",One of only three women,llama3-8b-8192
q_727,What number was Beyoncé on the Top 20 Hot 100 Songwriters list?,17,llama3-8b-8192
q_728,To whom did Beyonce credit as her major influence on her music?,Michael Jackson,llama3-8b-8192
q_729,How old was Beyonce when she went to her first Michael Jackson concert as a kid?,Five,llama3-8b-8192
q_73,How many undergrads were attending Notre Dame in 2014?,UNKNOWN,llama3-8b-8192
q_730,Beyonce gave a tribute award to who in 2006?,Michael Jackson,llama3-8b-8192
q_731,Beyonce cites Mariah Carey to making her want to start doing what?,practicing vocal runs as a child,llama3-8b-8192
q_732,Who influenced Beyonce?,"Michael Jackson, Diana Ross, Whitney Houston, Mariah Carey, Aaliyah, Prince, Lauryn Hill, Sade Adu, Donna Summer, Mary J",llama3-8b-8192
q_733,What song by Mariah Carey influenced her?,Vision of Love,llama3-8b-8192
q_734,Who is Beyoncé's biggest musical influence?,Michael Jackson,llama3-8b-8192
q_735,What was Beyoncé's first concert?,Michael Jackson,llama3-8b-8192
q_736,Who does Beyoncé feel is an all-around entertainer?,Diana Ross,llama3-8b-8192
q_737,"Who does she credit for the inspiration to ""get up there and do what she did""?",Whitney Houston,llama3-8b-8192
q_738,What song caused Beyoncé to practice runs as a child?,Vision of Love,llama3-8b-8192
q_739,What themes were influenced by her acting role in Dreamgirls?,Feminism and female empowerment,llama3-8b-8192
q_74,What percentage of students at Notre Dame are the children of former Notre Dame students?,21–24%,llama3-8b-8192
q_740,"Which singer did Beyonce honor by entertaining with her song ""Deja Vu""?",Josephine Baker,llama3-8b-8192
q_741,Who motivated Beyonce to explore other areas of music?,Jay Z and Etta James,llama3-8b-8192
q_742,What movie influenced Beyonce towards empowerment themes?,Dreamgirls,llama3-8b-8192
q_743,How did Etta James influence her?,Etta James inspired Beyoncé to explore other musical genres and styles,llama3-8b-8192
q_744,Where did she perform wearing Baker's hula skirt?,The 2006 Fashion Rocks concert,llama3-8b-8192
q_745,What singer inspired Beyoncé's B'Day album?,Josephine Baker,llama3-8b-8192
q_746,What song did Beyoncé sing at a 2006 concert to honor Josephine Baker?,Déjà Vu,llama3-8b-8192
q_747,"Beyonce has noted which first lady with saying ""She proves you can do it all""?",Michelle Obama,llama3-8b-8192
q_748,Which month and year did Beyonce credit Madonna for inspiring her to take control of her career?,February 2013,llama3-8b-8192
q_749,"Beyonce has said that who embodies the ""definition of inspiration and a strong woman""?",Oprah Winfrey,llama3-8b-8192
q_75,How many teams participate in the Notre Dame Bookstore Basketball tournament?,over 700,llama3-8b-8192
q_750,Who personally influences Beyonce?,"Michael Jackson, Diana Ross, Whitney Houston, Mariah Carey, Aaliyah, Prince, Lauryn Hill, Sade Adu, Donna Summer, Mary J",llama3-8b-8192
q_751,Hoe does she describe Oprah Winfrey?,the definition of inspiration and a strong woman,llama3-8b-8192
q_753,How does Madonna influence her?,She inspired her to take control of her own career,llama3-8b-8192
q_754,How does she describe Jay Z?,her husband,llama3-8b-8192
q_755,"Who inspires Beyoncé because ""she does it all?""",Michelle Obama,llama3-8b-8192
q_756,Who does Beyoncé describe as the definition of inspiration?,Oprah Winfrey,llama3-8b-8192
q_757,Who does Beyoncé describe as lyrical and raw?,Jean-Michel Basquiat,llama3-8b-8192
q_758,Who inspired Beyoncé to take control of her career?,Madonna,llama3-8b-8192
q_759,Beyonce had an all-female tour band whose name was what?,UNKNOWN,llama3-8b-8192
q_76,For what cause is money raised at the Bengal Bouts tournament at Notre Dame?,The Holy Cross Missions in Bangladesh,llama3-8b-8192
q_760,Beyonce had singers in the background known by the name as?,The Mamas,llama3-8b-8192
q_761,The Mamas members included which 3 musicians?,"Montina Cooper-Donnell, Crystal Collins and Tiffany Moniqué Riddick",llama3-8b-8192
q_762,The Mamas first appearance was when?,2006 BET Awards,llama3-8b-8192
q_763,What band did Beyonce introduce in 2006?,Suga Mama,llama3-8b-8192
q_764,What song name does the band Suga Mama and a song on the B'Day album share?,Suga Mama,llama3-8b-8192
q_765,Where did Suga Mama band make their first appearance?,The 2006 BET Awards,llama3-8b-8192
q_766,What band supports Beyonce in her tours?,Suga Mama,llama3-8b-8192
q_767,What is the name of Beyoncé's female tour band?,Suga Mama,llama3-8b-8192
q_768,Suga Mama is also a song on which Beyoncé album?,B'Day,llama3-8b-8192
q_769,What are Beyoncé's backup singers called?,Destiny's Child,llama3-8b-8192
q_77,How many students in total were at Notre Dame in 2014?,"12,179",llama3-8b-8192
q_770,When did The Mamas make their debut?,2006,llama3-8b-8192
q_771,What characteristics has Beyonce received acclaim for?,critic acclaim and commercial success,llama3-8b-8192
q_772,Which former president of Def Jam called Beyonce the greatest entertainer alive?,L,llama3-8b-8192
q_773,For what does Beyonce receive praise?,Her stage presence and voice during live performances,llama3-8b-8192
q_774,Who chose her as number one on his list of Best singers/ Dancers?,Jarett Wieselman of the New York Post,llama3-8b-8192
q_775,How has L.A. Reid described her?,the greatest entertainer alive,llama3-8b-8192
q_776,How does Alice Jones describe her?,takes her role as entertainer so seriously she's almost too good,llama3-8b-8192
q_777,Who has Beyoncé at number one on her Five Best Singer/Dancers?,Jarett Wieselman of the New York Post,llama3-8b-8192
q_778,Who has said that Beyoncé is the best entertainer alive?,L,llama3-8b-8192
q_779,Beyonce self proclaimed alter ego is named what?,Sasha Fierce,llama3-8b-8192
q_78,What percentage of undergrads live on the Notre Dame campus?,80%,llama3-8b-8192
q_780,Her alter ego was born when according to Beyonce?,"during the making of ""Crazy in Love",llama3-8b-8192
q_781,What year did Beyonce do away with Sasha Fierce?,2010,llama3-8b-8192
q_782,Beyonce brought back Sasha Fierce during which event?,Revel Presents: Beyoncé Live shows in May 2012,llama3-8b-8192
q_783,How does she describe Sasha?,"too aggressive, too strong, too sassy [and] too sexy",llama3-8b-8192
q_784,Later what did she say about Sasha?,She announced in May 2012 that she would bring her back for her Revel Presents: Beyoncé Live shows later that month,llama3-8b-8192
q_785,What is the name of Beyoncé's alter ego?,Sasha Fierce,llama3-8b-8192
q_786,When did Beyoncé introduce Sasha Fierce?,2008,llama3-8b-8192
q_787,Sasha Fierce was created during the making of what song?,Crazy in Love,llama3-8b-8192
q_788,Who did Beyoncé tell in February 2010 that Sasha Fierce was no longer needed?,Allure magazine,llama3-8b-8192
q_789,Beyonce's sex appeal is characterized as what?,Having a wide-ranging sex appeal,llama3-8b-8192
q_79,How many student housing areas are reserved for Notre Dame's graduate students?,Four,llama3-8b-8192
q_790,"Which music journalist described Beyonce as a ""crossover sex symbol?""",Touré,llama3-8b-8192
q_791,Which word spawned from a term used to describe Beyonce in 2006?,Bootylicious,llama3-8b-8192
q_792,Bootylicious was a song from which act that Beyonce performed with?,Destiny's Child,llama3-8b-8192
q_793,Oxford Dictionary added which word from the 2000s dedicated to Beyonce?,Bootylicious,llama3-8b-8192
q_794,What word is often used to describe Beyonce/,The Bey Hive,llama3-8b-8192
q_795,When was the term added to the dictionary?,2006,llama3-8b-8192
q_796,"What journalist wrote that Beyoncé was a ""sex symbol""?",Touré,llama3-8b-8192
q_797,"Because of Beyoncé's physical shape, what slang term has been used to describe her?",Bootylicious,llama3-8b-8192
q_798,In what year was the slang term from a title of a Destiny's Child song that is also used to describe Beyoncé put in the dictionary?,2006,llama3-8b-8192
q_799,How does Beyoncé say she likes to dress off-stage?,she likes to dress sexily,llama3-8b-8192
q_8,How many student news papers are found at Notre Dame?,Four,llama3-8b-8192
q_80,How many dorms for males are on the Notre Dame campus?,15,llama3-8b-8192
q_800,"in September 2010, what career area did Beyonce start exploring?",Acting,llama3-8b-8192
q_801,Beyonce's first modelling event was at where?,UNKNOWN,llama3-8b-8192
q_802,"""World's Most Beautiful woman"" was declared to Beyonce by which national magazine?",People,llama3-8b-8192
q_803,Which month and year did GQ feature Beyonce on its cover?,January 2013,llama3-8b-8192
q_804,What TV network listed Beyonce as number 1 on its 100 Sexiest Artists list?,VH1,llama3-8b-8192
q_805,Who called Beyonce the World's most Beautiful Woman?,People,llama3-8b-8192
q_806,Who called her Hottest Female Singer of all Time?,Complex,llama3-8b-8192
q_807,When did she appear on the cover of GQ?,January 2013,llama3-8b-8192
q_808,VH1 listed her at what number on their 100 Sexiest Artists list?,1,llama3-8b-8192
q_809,What year did Beyoncé first model for Tom Ford?,2010,llama3-8b-8192
q_81,What amount of the graduate student body at Notre Dame live on the campus?,20%,llama3-8b-8192
