qid,question,answer_with_context,model
q_810,"What magazine said Beyoncé was the ""World's Most Beautiful Woman""?",People,llama3-8b-8192
q_811,What title did Complex award Beyoncé?,UNKNOWN,llama3-8b-8192
q_812,What museum has made several models of Beyoncé in wax?,Madame Tussauds Wax Museums,llama3-8b-8192
q_813,Which parent of Beyonce's help co-write a book?,UNKNOWN,llama3-8b-8192
q_814,Which African-American woman before Beyonce had posed for SI Swimsuit issue?,UNKNOWN,llama3-8b-8192
q_815,What was the title of Beyonce's mother's book?,Destiny's Style,llama3-8b-8192
q_816,When was she on the Sports Illustrated cover?,2007,llama3-8b-8192
q_817,Who was she the second African American on the cover after?,Tyra Banks,llama3-8b-8192
q_818,"Beyoncé was the second African American woman featured as a swimsuit cover on the magazine, who was first?",Tyra Banks,llama3-8b-8192
q_819,"What magazine said Beyoncé was the ""best-dressed celebrity""?",Vogue,llama3-8b-8192
q_82,There are how many dorms for females at Notre Dame?,14,llama3-8b-8192
q_820,Beyonce has a fan base that is referred to as what?,The Bey Hive,llama3-8b-8192
q_821,"Before the Bey Hive, fans of Beyonce were called what?",The Beyontourage,llama-3.1-8b-instant
q_822,Which social media company proclaimed Beyonce fans are know as the Bey Hive?,Twitter,llama-3.1-8b-instant
q_823,What is Beyonce's fan base called?,The Bey Hive,llama-3.1-8b-instant
q_824,What did the fans used to be called?,The Beyontourage,llama-3.1-8b-instant
q_825,What is the latest term used to describe Beyoncé fans?,The Bey Hive,llama-3.1-8b-instant
q_826,What was the former word given to Beyoncé fans?,The Beyontourage,llama-3.1-8b-instant
q_827,"What word does ""Bey Hive"" derive from?",beehive,llama-3.1-8b-instant
q_828,Beyonce has a clothing line known as what?,House of Deréon,llama-3.1-8b-instant
q_829,Which French magazine did Beyonce show up on the cover of?,L'Officiel,llama-3.1-8b-instant
q_83,What is Congregation of Holy Cross in Latin?,Congregatio a Sancta Cruce,llama-3.1-8b-instant
q_830,Beyonce was seen wearing what on the french magazine that caused controversy?,blackface and tribal makeup,llama-3.1-8b-instant
q_831,Which year did PETA spark controversy with Beyonce?,2006,llama-3.1-8b-instant
q_832,What did PETA criticize Beyonce for in 2006?,wearing and using fur in her clothing line House of Deréon,llama-3.1-8b-instant
q_833,What French Magazine cover did the media criticize?,L'Officiel,llama-3.1-8b-instant
q_834,How was she dressed on the cover of L'Officiel?,In blackface and tribal makeup,llama-3.1-8b-instant
q_835,What French magazine did Beyoncé appear in wearing blackface and tribal makeup?,L'Officiel,llama-3.1-8b-instant
q_836,What clothing line of Beyoncé drew PETA criticism?,House of Deréon,llama-3.1-8b-instant
q_837,What type of magazine is L'Officiel?,French fashion magazine,llama-3.1-8b-instant
q_838,Which racial community gave criticism to Beyonce?,The African-American community,llama-3.1-8b-instant
q_839,Which professor from Northeastern University wrote about how race correlates with these criticisms of Beyonce?,Emmett Price,llama-3.1-8b-instant
q_84,What percentage of Notre Dame students feel they are Christian?,over 93%,llama-3.1-8b-instant
q_840,Which company was accused of coloring Beyonce's hair?,L'Oréal,llama-3.1-8b-instant
q_841,What did Vogue request?,"only ""natural pictures be used",llama-3.1-8b-instant
q_842,How did L'Oreal respond to accusations of changing pictures?,it is categorically untrue,llama-3.1-8b-instant
q_843,"In addition to her light skin color, what else has made part of the African American community criticize Beyoncé?",Her costuming and use of fur in her clothing line,llama-3.1-8b-instant
q_844,"In 2007, which music professor said he believes this criticism does involve race as well?",Emmett Price,llama-3.1-8b-instant
q_845,Who was accused of lightening Beyoncé's skin for an advertisement?,L'Oréal,llama-3.1-8b-instant
q_846,What advertisement was Beyoncé's skin supposedly lightened in?,Feria hair color advertisements,llama-3.1-8b-instant
q_847,Who did Beyoncé tell in 2013 to only use natural pictures of her rather than retouched images?,H&M,llama-3.1-8b-instant
q_848,Artist of the Decade was bestowed upon Beyonce from which magazine?,The Observer and Billboard,llama-3.1-8b-instant
q_849,Whats the first year that Beyonce appear on the Time 100 list?,2013,llama-3.1-8b-instant
q_85,How often is Catholic mass held at Notre Dame in a week?,over 100 times per week,llama-3.1-8b-instant
q_850,Beyonce than appeared again on the Time 100 list in what year?,2014,llama-3.1-8b-instant
q_851,What did the Guardian name her?,Artist of the Decade,llama-3.1-8b-instant
q_852,When did Beyonce first make the Time 100 List?,2013,llama-3.1-8b-instant
q_853,When was she again on the Time 100 List and on the cover?,2014,llama-3.1-8b-instant
q_854,Who said that she is the reigning national voice?,Baz Luhrmann,llama-3.1-8b-instant
q_855,Who stated that Beyoncé is the most important musician of the 21st century?,Jody Rosen,llama-3.1-8b-instant
q_856,Which publication named Beyoncé the Artist of the Decade?,"The Observer, Billboard, and The Guardian",llama-3.1-8b-instant
q_857,What list did Beyoncé make in 2013?,"GQ's ""100 Sexiest Women of the 21st Century"" list",llama-3.1-8b-instant
q_858,Who said Beyoncé is the heir-apparent diva of the United States?,UNKNOWN,llama-3.1-8b-instant
q_859,What year was Beyoncé featured both on the Time 100 list as well as the cover of the issue?,2014,llama-3.1-8b-instant
q_86,How many chapels are on the Notre Dame campus?,Fifty-seven,llama-3.1-8b-instant
q_860,Which rock band cited Beyonce on their third album?,White Rabbits,llama-3.1-8b-instant
q_861,"Which friend learned from Beyonce while preparing for the film, ""Country Strong?""",Gwyneth Paltrow,llama-3.1-8b-instant
q_862,Nicky Minaj became a spokesperson for which brand of soda after seeing Beyonce involved with it?,Pepsi,llama-3.1-8b-instant
q_863,What influenced Nicki Minaj to join the Pepsi global campaign?,Seeing Beyoncé's Pepsi commercial,llama-3.1-8b-instant
q_864,Which band listed Beyonce as an inspiration on their latest album?,White Rabbits,llama-3.1-8b-instant
q_865,What about Beyonce has influenced many entertainers?,Her work,llama-3.1-8b-instant
q_866,For what film was Paltrow studying Beyonce ?,Country Strong,llama-3.1-8b-instant
q_867,Which Indie band said Beyoncé was an inspiration for one of hteir albums?,White Rabbits,llama-3.1-8b-instant
q_868,What was the name of the White Rabbits' album?,Milk Famous,llama-3.1-8b-instant
q_869,Who studied Beyoncé during live concerts for research for a film's music role?,Gwyneth Paltrow,llama-3.1-8b-instant
q_87,What amount of the student body of Notre Dame identifies as Catholic?,over 80%,llama-3.1-8b-instant
q_870,What was the name of the film that Gwyneth Paltrow starred in as a musician?,Country Strong,llama-3.1-8b-instant
q_871,Beyoncé's Pepsi commercial inspired which star to join Pepsi's global campaign in 2012?,Nicki Minaj,llama-3.1-8b-instant
q_872,"VH1 declared what song the ""Greatest song of the 2000s?""",Crazy in Love,llama-3.1-8b-instant
q_873,"How many Grammy awards did ""Crazy in Love"" win?",Two Grammy Awards,llama-3.1-8b-instant
q_874,How many did Crazy in Love sell to become one of the greatest selling singles in history?,8 million copies,llama-3.1-8b-instant
q_875,What type of organism was named after Beyonce in 2012?,UNKNOWN,llama-3.1-8b-instant
q_876,A place for Beyonce in the Rock and Roll Hall of fame was awarded when?,July 2014,gemma2-9b-it
q_877,Which of Beyonce's songs was called Greatest Song of the 2000s?,Crazy in Love,gemma2-9b-it
q_878,How many Grammy awards did Crazy in Love get?,2,gemma2-9b-it
q_879,How many copies did Crazy in Love sell?,8 million,gemma2-9b-it
q_88,What was the music hall at Notre Dame called?,UNKNOWN,gemma2-9b-it
q_880,Who released the single Girls Love Beyonce?,UNKNOWN,gemma2-9b-it
q_881,Which publication considers Crazy in Love to be one of the top 500 songs of all time?,Rolling Stone,gemma2-9b-it
q_882,"Who sang ""Girls Love Beyoncé"" in 2013?",Drake,gemma2-9b-it
q_883,What did Bryan Lessard name after Beyoncé?,Scaptia beyonceae,gemma2-9b-it
q_884,How many copies of her albums as Beyonce sold in the US?,UNKNOWN,gemma2-9b-it
q_885,"Totaling worldwide, how many records as Beyonce sold?",118 million,gemma2-9b-it
q_886,How many certifications was Beyonce awarded by the RIAA?,64,gemma2-9b-it
q_887,"When Beyonce was with Destiny's Child, how many albums did she manage to sell?",60 million,gemma2-9b-it
q_888,Who was the first female to achieve the International Artist Award at the American Music Awards?,Beyoncé,gemma2-9b-it
q_889,How many albums has Beyonce as a solo artist sold in the U.S?,Over 15 million,gemma2-9b-it
q_89,In what year was the Main Building at Notre Dame razed in a fire?,1879,gemma2-9b-it
q_890,How many has she sold worldwide?,118 million,gemma2-9b-it
q_891,How many records has she sold with Destiny's Child?,60 million,gemma2-9b-it
q_892,When did she receive the Legend Award?,2008,gemma2-9b-it
q_893,How many music certifications has she received in the 2000s?,64,gemma2-9b-it
q_894,How many records has Beyoncé sold in the United States?,UNKNOWN,gemma2-9b-it
q_895,How many records has Beyoncé sold throughout the world?,178 million,gemma2-9b-it
q_896,Who cited Beyoncé as being the top certified artist of the 2000s?,The Recording Industry Association of America (RIAA),gemma2-9b-it
q_897,How many certifications did RIAA give Beyoncé?,64,gemma2-9b-it
q_898,When did Beyoncé receive the Legend Award?,2008,gemma2-9b-it
q_899,How many Grammys has Beyonce won total with and without Destiny's Child?,20,gemma2-9b-it
q_9,In what year did the student paper Common Sense begin publication at Notre Dame?,1987,gemma2-9b-it
q_90,Who was the president of Notre Dame in 1879?,Rev,gemma2-9b-it
q_900,Who is the only other woman with more Grammy awards than Beyonce?,Alison Krauss,gemma2-9b-it
q_901,Beyonce has been awarded how many Grammy nominations?,52,gemma2-9b-it
q_902,Beyonce holds the record for how many wins in one night by a female?,6,gemma2-9b-it
q_903,How many awards at the Broadcast Film Critics Association Awards in 2006 did Beyonce bring home?,2,gemma2-9b-it
q_904,How many Grammies has Beyonce won?,20,gemma2-9b-it
q_905,How many Grammy nominations does Beyonce have?,52,gemma2-9b-it
q_906,When did she set the record for most Grammy awards won in one night?,2010,gemma2-9b-it
q_907,Who tied her record for most Grammies won in one night in 2012?,Adele,gemma2-9b-it
q_908,How many Grammys has Beyoncé won?,20,gemma2-9b-it
q_909,How many Grammy nominations has Beyoncé had?,52,gemma2-9b-it
q_91,On what date was the rebuilding of The Main Building begun at Notre Dame after the fire that claimed the previous?,"May 17, 1879",gemma2-9b-it
q_910,What Beyoncé song was song of the year on 2010?,Single Ladies (Put a Ring on It),gemma2-9b-it
q_911,What movie had Beyoncé nominated as Best Actress for Golden Globe Awards?,Dreamgirls,gemma2-9b-it
q_912,Which soda company has Beyonce partnered with since 2002?,UNKNOWN,gemma2-9b-it
q_913,Pepsi paid Beyonce how much in 2012 for her endorsement?,$50 million,gemma2-9b-it
q_914,Which organization wrote a letter to Beyonce after her Pepsi endorsement deal?,Center for Science in the Public Interest (CSPINET),gemma2-9b-it
q_915,What percentage of people were positive about Beyonce's endorsement of Pepsi?,70,gemma2-9b-it
q_916,When did Beyonce begin doing Pepsi advetisments?,2002,gemma2-9b-it
q_917,Who was in the commercial with Beyonce in 2004?,"Britney Spears, Pink, and Enrique Iglesias",meta-llama/llama-4-maverick-17b-128e-instruct
q_918,What did she agree to do for 50 million dollars in 2012?,endorse Pepsi,meta-llama/llama-4-maverick-17b-128e-instruct
q_919,Who sent her a letter asking that she reconsider the Pepsi deal?,The Center for Science in the Public Interest (CSPINET),meta-llama/llama-4-maverick-17b-128e-instruct
q_92,What did the Science Hall at Notre Dame come to be known as?,LaFortune Student Center,meta-llama/llama-4-maverick-17b-128e-instruct
q_920,What soft drink company has Beyoncé worked with since 2002?,Pepsi,meta-llama/llama-4-maverick-17b-128e-instruct
q_921,How much did Beyoncé get for a deal with a soft drink company in 2012?,$50 million,meta-llama/llama-4-maverick-17b-128e-instruct
q_922,Who asked her to change her mind about the soft drink deal due to the nature of the product?,The Center for Science in the Public Interest (CSPINET),meta-llama/llama-4-maverick-17b-128e-instruct
q_923,What organization discovered that the advertisements Beyoncé did for the soft drink company were 70% positive?,NetBase,meta-llama/llama-4-maverick-17b-128e-instruct
q_924,"Beyonce worked with who on her perfumes, True Star and True Star Gold?",Tommy Hilfiger,meta-llama/llama-4-maverick-17b-128e-instruct
q_925,The world's best selling celebrity perfume line belongs to whom?,Beyoncé,meta-llama/llama-4-maverick-17b-128e-instruct
q_926,Beyonce's first fragrance had what name?,Heat,meta-llama/llama-4-maverick-17b-128e-instruct
q_927,The Mrs. Carter Show Limited Edition was released in what year?,2013,meta-llama/llama-4-maverick-17b-128e-instruct
q_928,How much money did The Mrs. Carter Show Limited Edition fragrance make?,$400 million,meta-llama/llama-4-maverick-17b-128e-instruct
q_929,What was Beyonce's 2010 perfume called?,UNKNOWN,meta-llama/llama-4-maverick-17b-128e-instruct
q_93,What type of education was pushed at Notre Dame before its embracing of national standards?,scholastic and classical emphasis,meta-llama/llama-4-maverick-17b-128e-instruct
q_930,"When was her second perfume, Heat Rush, released?",February 2011,meta-llama/llama-4-maverick-17b-128e-instruct
q_931,What was Beyonce's third perfume named?,UNKNOWN,meta-llama/llama-4-maverick-17b-128e-instruct
q_932,How many editions of Heat have been launched?,six,meta-llama/llama-4-maverick-17b-128e-instruct
q_933,Which Emporio Armani fragrance did Beyoncé promote in 2007?,Diamonds fragrance,meta-llama/llama-4-maverick-17b-128e-instruct
q_934,What year did Beyoncé introduce her first fragrance?,2010,meta-llama/llama-4-maverick-17b-128e-instruct
q_935,What was Beyoncé's first fragrance called?,Heat,meta-llama/llama-4-maverick-17b-128e-instruct
q_936,How many editions of Heat exist?,six,meta-llama/llama-4-maverick-17b-128e-instruct
q_937,How young was Beyonce when she acquired deals from American Express and L'Oreal?,18,meta-llama/llama-4-maverick-17b-128e-instruct
q_938,What was the name of the video game that was cancelled for Beyonce?,Starpower: Beyoncé,meta-llama/llama-4-maverick-17b-128e-instruct
q_939,When did Beyonce begin her deals with name brands?,2002,meta-llama/llama-4-maverick-17b-128e-instruct
q_94,Which college did Notre Dame add in 1921?,College of Commerce,meta-llama/llama-4-maverick-17b-128e-instruct
q_940,How many people lost jobs when Beyonce left the video game deal?,70,meta-llama/llama-4-maverick-17b-128e-instruct
q_941,How was the suit settled?,out of court,meta-llama/llama-4-maverick-17b-128e-instruct
q_942,What was the name of the video game?,Starpower: Beyoncé,meta-llama/llama-4-maverick-17b-128e-instruct
q_943,What video game did Beyoncé back out of?,Starpower: Beyoncé,meta-llama/llama-4-maverick-17b-128e-instruct
q_944,What company was producing the video game?,GateFive,meta-llama/llama-4-maverick-17b-128e-instruct
q_945,How many people lost their jobs over Beyoncé backing out of the deal?,70 staff,meta-llama/llama-4-maverick-17b-128e-instruct
q_946,When was the disagreement settled out of court?,June 2013,meta-llama/llama-4-maverick-17b-128e-instruct
q_947,Who did Bayonce's management go into business with in 2014?,Topshop,meta-llama/llama-4-maverick-17b-128e-instruct
q_948,"After their agreement together, Beyonce's and Topshop"" new business was called what?",Parkwood Topshop Athletic Ltd,meta-llama/llama-4-maverick-17b-128e-instruct
q_949,What type of clothing does Parkwood Topshop Athletic Ltd produce?,"athletic, street wear brand",meta-llama/llama-4-maverick-17b-128e-instruct
q_95,"In 1919 a new president of Notre Dame was named, who was it?",Father James Burns,meta-llama/llama-4-maverick-17b-128e-instruct
q_950,The company and products were set to be in stores when?,fall of 2015,meta-llama/llama-4-maverick-17b-128e-instruct
q_951,Who did Beyonce partner with in London?,Topshop,meta-llama/llama-4-maverick-17b-128e-instruct
q_952,When will the new line launch?,April 2016,meta-llama/llama-4-maverick-17b-128e-instruct
q_953,What is the name of Beyoncé's management company?,Parkwood Entertainment,meta-llama/llama-4-maverick-17b-128e-instruct
q_954,Who did Beyoncé and Parkwood Entertainment partner with in October 2014?,Topshop,meta-llama/llama-4-maverick-17b-128e-instruct
q_955,Where is Topshop located?,London,meta-llama/llama-4-maverick-17b-128e-instruct
q_956,What was the new division of Topshop because of the partnership?,"an athletic, street wear brand",meta-llama/llama-4-maverick-17b-128e-instruct
q_957,"When was it discovered Beyonce was a co-owner of the music service, Tidal?",UNKNOWN,meta-llama/llama-4-maverick-17b-128e-instruct
q_958,The parent company of Tidal became under the ownership of whom in 2015?,Jay Z,meta-llama/llama-4-maverick-17b-128e-instruct
q_959,When was it announced that Beyonce was a co-owner in Tidal?,UNKNOWN,meta-llama/llama-4-maverick-17b-128e-instruct
q_96,Over how many years did the change to national standards undertaken at Notre Dame in the early 20th century take place?,3 years,meta-llama/llama-4-maverick-17b-128e-instruct
q_960,What kind of service is Tidal?,music streaming service,meta-llama/llama-4-maverick-17b-128e-instruct
q_961,What is a criticism of other streaming services?,low payout of royalties,meta-llama/llama-4-maverick-17b-128e-instruct
q_962,What music streaming system is Beyoncé part owner of?,Tidal,meta-llama/llama-4-maverick-17b-128e-instruct
q_963,What is the parent company of the music service Beyoncé owns part of?,Aspiro,meta-llama/llama-4-maverick-17b-128e-instruct
q_964,Who acquired the parent company of the music service Beyoncé owns part of?,Jay Z,meta-llama/llama-4-maverick-17b-128e-instruct
q_965,What music service is accused of providing low royalty amounts?,Spotify,meta-llama/llama-4-maverick-17b-128e-instruct
q_966,House of Dereon became known through Beyonce and which of Beyonce's relatives?,UNKNOWN,meta-llama/llama-4-maverick-17b-128e-instruct
q_967,Beyonce's grandma's name was?,UNKNOWN,meta-llama/llama-4-maverick-17b-128e-instruct
q_968,Beyonce's family's company name is what?,Beyond Productions,meta-llama/llama-4-maverick-17b-128e-instruct
q_969,What types of garments are sold by Beyonce's clothing line?,"dance, fitness and sports ranges",meta-llama/llama-4-maverick-17b-128e-instruct
q_97,Those who attended a Jesuit college may have been forbidden from joining which Law School due to the curricula at the Jesuit institution?,Harvard Law School,meta-llama/llama-4-maverick-17b-128e-instruct
q_970,Which two countries can you purchase Beyonce's clothing line?,"UK and USA (implied, as Topshop is a British retailer, but not directly stated; however, the answer can be derived from the fact that Topshop is British)",meta-llama/llama-4-maverick-17b-128e-instruct
q_971,"Who partnered with Beyonce to start the clothing line, Dereon?",UNKNOWN,meta-llama/llama-4-maverick-17b-128e-instruct
q_972,When did Beyonce and her mother start Dereon?,2005,meta-llama/llama-4-maverick-17b-128e-instruct
q_973,Who was the business named for in Beyonce's family?,Agnèz Deréon,meta-llama/llama-4-maverick-17b-128e-instruct
q_974,Where were items from the clothing line displayed?,UNKNOWN,meta-llama/llama-4-maverick-17b-128e-instruct
q_975,Who shares in the House of Deréon fashion line introduction with Beyoncé?,Beyoncé's mother,meta-llama/llama-4-maverick-17b-128e-instruct
q_976,What is the name of the House of Deréon junior collection?,Deréon,meta-llama/llama-4-maverick-17b-128e-instruct
q_977,What type of accessory company did Beyonce partner with in 2005?,"House of Brands, a shoe company",meta-llama/llama-4-maverick-17b-128e-instruct
q_978,"In 2010, Beyonce released Dereon to what country?",UNKNOWN,meta-llama/llama-4-maverick-17b-128e-instruct
q_979,Back-to-school shopping was introduced in what year of Beyonce's clothing line?,UNKNOWN,meta-llama/llama-4-maverick-17b-128e-instruct
q_98,"The Notre Dame football team got a new head coach in 1918, who was it?",Knute Rockne,meta-llama/llama-4-maverick-17b-128e-instruct
q_980,What did Beyonce's Fashion Diva feature?,the House of Deréon collection,meta-llama/llama-4-maverick-17b-128e-instruct
q_981,What new idea did Beyonce and her mother launch in 2009?,"Sasha Fierce for Deréon, a junior apparel label",meta-llama/llama-4-maverick-17b-128e-instruct
q_982,When did Beyonce partner with C&A to sell fashion in Brazil?,"May 27, 2010",meta-llama/llama-4-maverick-17b-128e-instruct
q_983,What company did Beyoncé get together with in 2005 to add shoes to her fashions?,House of Brands,meta-llama/llama-4-maverick-17b-128e-instruct
q_984,What was the name of the game put out by Starwave Mobile in 2008 that featured Beyoncé fashions?,Beyoncé Fashion Diva,meta-llama/llama-4-maverick-17b-128e-instruct
q_985,What was the name of the junior fashions launched in 2009 by Beyoncé and her mother?,Sasha Fierce for Deréon,meta-llama/llama-4-maverick-17b-128e-instruct
q_986,Who did Beyoncé team up with in 2010 to get her fashions into Brazil?,C&A,meta-llama/llama-4-maverick-17b-128e-instruct
q_987,Sasha Fierce for Deréon fashions were sold at stores that included Macy's and what other store?,Dillard's,meta-llama/llama-4-maverick-17b-128e-instruct
q_988,"Beyonce, during October 2014, partnered with whom to produce an outdoor line of clothing?",Topshop,meta-llama/llama-4-maverick-17b-128e-instruct
q_989,Beyonce and Topshops first products were to be sold in stores when?,April 2016,meta-llama/llama-4-maverick-17b-128e-instruct
q_99,What was the amount of wins Knute Rockne attained at Notre Dame while head coach?,105 wins,meta-llama/llama-4-maverick-17b-128e-instruct
q_990,What is the new business called?,Parkwood Topshop Athletic Ltd,meta-llama/llama-4-maverick-17b-128e-instruct
q_991,What is Beyonce's percentage of ownership in the new venture?,50%,meta-llama/llama-4-maverick-17b-128e-instruct
q_992,When will the full line appear?,April 2016,meta-llama/llama-4-maverick-17b-128e-instruct
q_993,What company did Beyoncé contract with to sell clothing in England?,UNKNOWN,meta-llama/llama-4-maverick-17b-128e-instruct
q_994,What is the name of the equal partnership's fashion line between Beyoncé and the British company to come out in 2016?,Parkwood Topshop Athletic Ltd,meta-llama/llama-4-maverick-17b-128e-instruct
q_995,What type of clothing does the British partnership with Beyoncé sell?,activewear,meta-llama/llama-4-maverick-17b-128e-instruct
q_996,What national disaster caused Beyonce to create the Survivor Foundation?,Hurricane Katrina,meta-llama/llama-4-maverick-17b-128e-instruct
q_997,"How much cash did Beyonce put into the venture, the Survivor Foundation at startup?","$250,000",meta-llama/llama-4-maverick-17b-128e-instruct
q_998,What hurricane years later after Katrina did the organization provide support for?,Hurricane Ike three years later,meta-llama/llama-4-maverick-17b-128e-instruct
q_999,What did Beyonce and Rowland found in 2005?,Survivor Foundation,meta-llama/llama-4-maverick-17b-128e-instruct
