qid,question,answer_with_context,model
q_334,What was the name of Beyoncé's first dance instructor?,Darlette Johnson,gemma2-9b-it
q_335,How old was Beyoncé when she won a school talent show?,seven,gemma2-9b-it
q_336,What choir did Beyoncé sing in for two years?,St,gemma2-9b-it
q_337,Who decided to place Beyonce's group in Star Search the talent show?,Arne Frager,gemma2-9b-it
q_338,"In 1995, who decided to manage the girls singing group?",Mathew Knowles,gemma2-9b-it
q_339,Who was the first record label to give the girls a record deal?,Elektra Records,gemma2-9b-it
q_34,How many stories tall is the main library at Notre Dame?,14,gemma2-9b-it
q_340,Who brought Beyonce to California and enter her group in Star Search?,Arne Frager,gemma2-9b-it
q_341,In what year did Beyonce's father quit his job to manage her group?,1995,gemma2-9b-it
q_342,What large record company recorded Beyonce's group's first album?,Columbia Records,gemma2-9b-it
q_343,What record company first signed Beyonce's group and later cut them?,Elektra Records,gemma2-9b-it
q_344,At what age did Beyonce meet LaTavia Robertson?,8,gemma2-9b-it
q_345,How old was Beyoncé when she met LaTavia Roberson?,8,gemma2-9b-it
q_346,What was the name of the first group Beyoncé was a part of?,Destiny's Child,gemma2-9b-it
q_347,Who placed Girl's Tyme in Star Search?,Arne Frager,gemma2-9b-it
q_348,When did Beyoncé begin to manage the girl group?,1995,gemma2-9b-it
q_349,"Who signed the girl group on October 5, 1995?",Dwayne Wiggins's Grass Roots Entertainment,gemma2-9b-it
q_35,What is the name of the main library at Notre Dame?,Theodore M,gemma2-9b-it
q_350,Which film featured Destiny's Child's first major single?,Men in Black,gemma2-9b-it
q_351,"For which song, did Destiny's Child take home the grammy award for best R&B performance?",Say My Name,gemma2-9b-it
q_352,"Who did Beyonce record with for the movie ""The Best Man?""",Marc Nelson,gemma2-9b-it
q_353,Beyonce's group changed their name to Destiny's Child in what year?,1996,gemma2-9b-it
q_354,The name Destiny's Child was based on a quote in which book of the Bible?,Isaiah,gemma2-9b-it
q_355,"Debut song, ""Killing Time"" was featured on what movie's sound track?",Men in Black,gemma2-9b-it
q_356,What song won Best R&B Performance in the 43 Annual Grammy Awards?,Say My Name,gemma2-9b-it
q_357,"What singer did Beyonce record a song with for the movie, ''The Best Man""?",Marc Nelson,gemma2-9b-it
q_358,Where did Destiny's Child get their name from?,A passage in the Book of Isaiah,gemma2-9b-it
q_359,"Destiny's Child song, Killing Time, was included in which film's soundtrack?",Men in Black,gemma2-9b-it
q_36,In what year was the Theodore M. Hesburgh Library at Notre Dame finished?,1963,gemma2-9b-it
q_360,What was Destiny's Child's first major song hit?,"No, No, No",gemma2-9b-it
q_361,When did Destiny's Child release their second album?,1999,gemma2-9b-it
q_362,"Who did Beyoncé sing a duet with for ""The Best Man"" film?",Marc Nelson,gemma2-9b-it
q_363,What mental health issue did Beyonce go through?,UNKNOWN,gemma2-9b-it
q_364,What event occured after she was publicly criticized?,Beyoncé experienced depression,gemma2-9b-it
q_365,Who supported Beyonce through her depression?,Her mother,gemma2-9b-it
q_366,What event caused Beyonce's depression?,The split with Luckett and Roberson,gemma2-9b-it
q_367,How long was Beyonce depressed?,A couple of years,gemma2-9b-it
q_368,Who helped Beyonce fight her depression the most?,Her mother,gemma2-9b-it
q_369,Who replaced Luckett and Roberson in Destiny's Child?,Farrah Franklin and Michelle Williams,gemma2-9b-it
q_37,Which artist created the mural on the Theodore M. Hesburgh Library?,Millard Sheets,gemma2-9b-it
q_370,Who was blamed for Luckett and Roberson leaving Destiny's Child?,Beyoncé,llama3-8b-8192
q_371,Who helped Beyoncé overcome her depression during the years following the Destiny's Child split?,Her mother,llama3-8b-8192
q_372,Which newest member was removed from Destiny's Child?,UNKNOWN,llama3-8b-8192
q_373,"""Charlie's Angels"" featured which single from the band members?",Independent Women Part I,llama3-8b-8192
q_374,"How many weeks did their single ""Independent Women Part I"" stay on top?",Eleven consecutive weeks,llama3-8b-8192
q_375,"For what network, did Beyonce land a major movie role in?",MTV,llama3-8b-8192
q_376,"Their third album, Survivor, sold how many during its first week?","663,000",llama3-8b-8192
q_377,What French composer wrote the original opera ''Carmen'' in the 19th century?,Georges Bizet,llama3-8b-8192
q_378,What album caused a lawsuit to be filed in 2001?,Survivor,llama3-8b-8192
q_379,Independent Women Part I was on which 2000 film's soundtrack?,Charlie's Angels,llama3-8b-8192
q_38,What is a common name to reference the mural created by Millard Sheets at Notre Dame?,Touchdown Jesus,llama3-8b-8192
q_380,Which film did Beyoncé star in 2001 with Mekhi Phifer?,Carmen: A Hip Hopera,llama3-8b-8192
q_381,What was the name of Destiny Child's third album?,Survivor,llama3-8b-8192
q_382,Who filed a lawsuit over Survivor?,Luckett and Roberson,llama3-8b-8192
q_383,When did Destiny's Child announce their hiatus?,"After releasing their holiday album 8 Days of Christmas in October 2001, the group announced a hiatus to further pursue solo careers",llama3-8b-8192
q_384,"Who did Beyonce star with in the movie, ""Austin Powers in Goldmember""?",Mike Myers,llama3-8b-8192
q_385,"Which three countries did Beyonce's song ""Work It Out"" achieve top ten status?",UNKNOWN,llama3-8b-8192
q_386,Beyonce starred with Cuba Gooding Jr. in which film?,The Fighting Temptations,llama3-8b-8192
q_387,"Who did Beyonce record the lead single with in the movie ""The Fighting Temptations""?","Missy Elliott, MC Lyte, and Free",llama3-8b-8192
q_388,Which other song from the soundtrack did better in the charts?,Summertime,llama3-8b-8192
q_389,What film did Beyonce appear in with Mike Myers?,Austin Powers in Goldmember,llama3-8b-8192
q_39,How many incoming students did Notre Dame admit in fall 2015?,"3,577",llama3-8b-8192
q_390,"What large amount did the movie ""Goldmember"" gross?",$73 million,llama3-8b-8192
q_391,"What genre of movie did Beyonce star in with Cuba Gooding, Jr?",Musical comedy,llama3-8b-8192
q_392,What song was the lead single from the film's sound track?,Work It Out,llama3-8b-8192
q_393,"How did the critics view the movie, ''The Fighting Temptations''?",The film received mixed reviews from critics,llama3-8b-8192
q_394,What film did Beyoncé star in with Mike Myers in 2002?,Austin Powers in Goldmember,llama3-8b-8192
q_395,What was Beyoncé's character called in Austin Powers in Goldmember?,Foxxy Cleopatra,llama3-8b-8192
q_396,Which song did Beyoncé release as the lead single for Austin Powers in Goldmember's soundtrack?,Work It Out,llama3-8b-8192
q_397,"What musical comedy did Beyoncé star in along with Cuba Gooding, Jr. in 2003?",The Fighting Temptations,llama3-8b-8192
q_398,What song did Beyoncé release as the lead single from The Fighting Tempations?,Fighting Temptation,llama3-8b-8192
q_399,What was the highest Beyonce's first solo recording achieved in the Billboard Hot 100?,number four,llama3-8b-8192
q_4,What sits on top of the Main Building at Notre Dame?,"The Word of Life mural, also known as ""Touchdown Jesus",llama3-8b-8192
q_40,What percentage of students were admitted to Notre Dame in fall 2015?,19,llama3-8b-8192
q_400,Beyonce's first album by herself was called what?,UNKNOWN,llama3-8b-8192
q_401,"How many has ""Dangerously in Love"" sould worldwide since its debut?",11 million,llama3-8b-8192
q_402,Beyonce's first number one song was which song?,"Bills, Bills, Bills",llama3-8b-8192
q_403,How many top five singles came from her first album?,Three,llama3-8b-8192
q_404,Beyonce's first solo album in the U.S. with what artist in the lead single?,Jay Z,llama3-8b-8192
q_405,What solo album did Beyonce release in 2003?,Dangerously in Love,llama3-8b-8192
q_406,"The album, Dangerously in Love achieved what spot on the Billboard Top 100 chart?",number four,llama3-8b-8192
q_407,"""The Closer I get to You"" was recorded with which artist?",Luther Vandross,llama3-8b-8192
q_408,Which artist was associated with Beyoncé's premiere solo recording?,Destiny's Child,llama3-8b-8192
q_409,When did Beyoncé release her first solo album?,"June 24, 2003",llama3-8b-8192
q_41,Where does Notre Dame rank in terms of academic profile among research universities in the US?,Among the top 10 to 15 in the nation for national research universities,llama3-8b-8192
q_410,What is the lead single on Beyoncé's first album?,Crazy in Love,llama3-8b-8192
q_411,Who helped Beyoncé earn a Grammy award for Best R&B Performance by a Duo or Group at the 46th annual Grammy Awards?,Luther Vandross,llama3-8b-8192
q_412,How many awards did Beyoncé win at the 46th Grammy's Awards?,Five,llama3-8b-8192
q_413,Destiny's Child's final album was named what?,Destiny Fulfilled,llama3-8b-8192
q_414,Destiny's Child got a star on the Hollywood Walk of Fame in what year?,March 2006,llama3-8b-8192
q_415,In what year did Beyonce embark on her Dangerously in Love tour of Europe?,November 2003,llama3-8b-8192
q_416,What was the name of the final album of Destiny's Child?,Destiny Fulfilled,llama3-8b-8192
q_417,It was announced that Destiny's Child would disban in what European city?,Barcelona,llama3-8b-8192
q_418,When did Destiny's Child get their star on the Hollywood Walk of Fame?,March 2006,llama3-8b-8192
q_419,What was the name of Beyoncé's European start that started in November 2003?,Dangerously in Love Tour,llama3-8b-8192
q_42,What percentage of students at Notre Dame participated in the Early Action program?,39,llama3-8b-8192
q_420,Who did Beyoncé tour with for the Verizon Lades First Tour?,Missy Elliott and Alicia Keys,llama3-8b-8192
q_421,"What major event did Beyoncé perform at on February 1, 2004?",Super Bowl XXXVIII,llama3-8b-8192
q_422,What is the name of the final studio album from Destiny's Child?,Destiny Fulfilled,llama3-8b-8192
q_423,How many albums did Beyonce sell in the first week when she released her second album?,"541,000",llama3-8b-8192
q_424,The lead single from the album was which song?,Déjà Vu,llama3-8b-8192
q_425,"How many countries did her song ""Irreplaceable"" get number one status in?",5,llama3-8b-8192
q_426,How many singles did her second album produce?,Five singles,llama3-8b-8192
q_427,What birthday did Beyonce's album B'Day celebrate?,Twenty-fifth,llama3-8b-8192
q_428,"What artist did Beyonce duet with in the single, ""Deja Vu''?",Jay Z,llama3-8b-8192
q_429,How high did ''Deja Vu'' climb on the Billboard chart?,Top five,llama3-8b-8192
q_43,How many miles does the average student at Notre Dame travel to study there?,750,llama3-8b-8192
q_430,What is the name of Beyoncé's second album?,B'Day,llama3-8b-8192
q_431,How many copies did B'Day sell during the first week of its release?,"541,000",llama3-8b-8192
q_432,"Who collaborated with Beyoncé on the single, Deja Vu?",Jay Z,llama3-8b-8192
q_433,Which single from B'Day was only released in the U.K.?,Green Light,llama3-8b-8192
q_434,What movie did Beyonce act in 2006?,Dreamgirls,llama3-8b-8192
q_435,Her second movie Beyonce did was what film?,The Pink Panther,llama3-8b-8192
q_436,"The single, ""Listen"" was featured in which movie?",Dreamgirls,llama3-8b-8192
q_437,Beyonce's first world tour was when?,2003,llama3-8b-8192
q_438,How much money did Beyonce's tour make in 2007?,UNKNOWN,llama3-8b-8192
q_439,How many millions of dollars did ''The Pink Panther'' gross world-wide?,$158,llama3-8b-8192
q_44,Where did U.S. News & World Report rank Notre Dame in its 2015-2016 university rankings?,UNKNOWN,llama3-8b-8192
q_440,What did Beyonce call her first concert tour?,The Dangerously in Love Tour,llama3-8b-8192
q_441,Who was Beyonce's duet with in ''Beautiful Liar''?,Shakira,llama3-8b-8192
q_442,Which film did Beyoncé star with Steve Martin in?,The Pink Panther,llama3-8b-8192
q_443,Beyoncé's role in Dreamgirls was based on what pop singer?,Diana Ross,llama3-8b-8192
q_444,What was the lead single for the Dreamgirls soundtrack?,Listen,llama3-8b-8192
q_445,What was the name of Beyoncé's first international tour?,Dangerously in Love Tour,llama3-8b-8192
q_446,What pop singer did a duet with Beyoncé on Beautiful Liar?,Shakira,llama3-8b-8192
q_447,Beyonce got married in 2008 to whom?,Jay Z,llama3-8b-8192
q_448,"Her third album, ""I am...Sasha Fierce"" was released when?","November 18, 2008",llama3-8b-8192
q_449,"For which decade, did Beyonce have more top ten songs than any other woman?",2000s,llama3-8b-8192
q_45,Forbes.com placed Notre Dame at what position compared to other US research universities?,UNKNOWN,llama3-8b-8192
q_450,Which singer beat out Beyonce for best video performance?,Taylor Swift,llama3-8b-8192
q_451,"In 2009, Beyonce started her second world tour and grossed how much money?",$119,llama3-8b-8192
q_452,How did she reveal the marriage?,"In a video montage at the listening party for her third studio album, I Am",llama3-8b-8192
q_453,When did Beyonce begin her second world tour?,2009–2010,llama3-8b-8192
q_454,Who beat out Beyonce for Best Female Video ?,Taylor Swift,llama3-8b-8192
q_455,How much did the second world tour make in dollars?,$80 million,llama3-8b-8192
q_456,When did Beyoncé get married?,"April 4, 2008",llama3-8b-8192
q_457,Who did Beyoncé marry?,Jay Z,llama3-8b-8192
q_458,Who is Beyoncé's alter ego?,Sasha Fierce,llama3-8b-8192
q_459,The video for what song won Beyoncé the 2009 MTV Video of the Year award?,Single Ladies (Put a Ring on It),llama3-8b-8192
q_46,The undergrad school at the Mendoza College of Business was ranked where according to BusinessWeek?,1st overall,llama3-8b-8192
q_460,Which prominent star felt the 2009 Female Video of the Year award should have went to Beyoncé instead of Taylor Swift?,Kanye West,llama3-8b-8192
q_461,"Beyonce portrayed which character in the film, Cadillac Records?",Etta James,llama3-8b-8192
q_462,Beyonce gave her entire salary from Cadillac Records to which organization?,Phoenix House,llama3-8b-8192
q_463,Which song did Beyonce sing at the first couple's inaugural ball?,At Last,llama3-8b-8192
q_464,"What genre of film was the movie, Obsessed, in which Beyonce starred in?",Thriller,llama3-8b-8192
q_465,"A fight scene from the movie, Obsessed, won which award for Beyonce?",2010 MTV Movie Award for Best Fight,llama3-8b-8192
q_466,Where did Beyonce donate her salary from the movie Cadillac Records?,Phoenix House,llama3-8b-8192
q_467,What thriller film did Beyonce star in?,Obsessed,llama3-8b-8192
q_468,What was the name of the woman she played in Obsessed?,Sharon Charles,llama3-8b-8192
q_469,How much more that the buget did the film gross?,$60 million,llama3-8b-8192
q_47,In 2014 what entity named Notre Dame 10th best of all American universities?,USA Today,llama3-8b-8192
q_470,Which singer did Beyoncé portray in Cadillac Records?,Etta James,llama3-8b-8192
q_471,Which organization received Beyoncé's entire Cadillac Records salary?,Phoenix House,llama3-8b-8192
q_472,"Where did Beyoncé perform on January 20, 2009?",The First Couple's first inaugural ball,llama3-8b-8192
q_473,Which thriller film did Beyoncé star in with Ali Larter?,Obsessed,llama3-8b-8192
q_474,How many awards was Beyonce nominated for at the 52nd Grammy Awards?,Ten,llama3-8b-8192
q_475,Beyonce tied with which artist for most nominations by a female artist?,Lauryn Hill,llama3-8b-8192
q_476,"In 2010, Beyonce worked with which other famous singer?",Gwyneth Paltrow,llama3-8b-8192
q_477,"How many number one singles did Beyonce now have after the song ""Telephone""?",Six,llama3-8b-8192
q_478,Beyonce tied who for most number one singles by a female?,Lady Gaga and Mariah Carey,llama3-8b-8192
q_479,Beyonce received how many nominations at the 52nd Annual Grammy Awards?,Ten,llama3-8b-8192
q_48,What percentage of Notre Dame students decide to study abroad?,57,llama3-8b-8192
q_480,What song was the sixth first place song for Beyonce?,Telephone,llama3-8b-8192
q_481,Who else appeared with Beyonce in Telephone?,Lady Gaga,llama3-8b-8192
q_482,Who did they tie with for six top songs?,Mariah Carey,llama3-8b-8192
q_483,Who did Beyonce tie with for the most nominations in a year?,Lauryn Hill,llama3-8b-8192
q_484,How many nominations did Beyoncé receive at the 52nd Grammy Awards ceremony?,Ten,llama3-8b-8192
q_485,Who did Beyoncé tie with for the most Grammy nominations for female artists?,Lauryn Hill,llama3-8b-8192
q_486,"Beyoncé was a featured artist on which singer's hit, Telephone?",Lady Gaga,llama3-8b-8192
q_487,Who did Beyoncé and Lady Gaga tie with for the most number one hits since 1992?,Mariah Carey,llama3-8b-8192
q_488,Beyonce would take a break from music in which year?,January 2010,llama3-8b-8192
q_489,Which year did Beyonce and her father part business ways?,2010,llama3-8b-8192
q_49,What person was the Director of the Science Museum at Notre Dame in the late 19th century?,"Father Joseph Carrier, C",llama3-8b-8192
q_490,Which famous landmark did Beyonce see in China?,The Great Wall of China,llama3-8b-8192
q_491,In what year did Beyonce have her hiatus?,2010,llama3-8b-8192
q_492,Who inspired this hiatus?,Her mother,llama3-8b-8192
q_493,When did she stop using her father as a manager?,UNKNOWN,llama3-8b-8192
q_494,How long did the hiatus last?,Nine months,llama3-8b-8192
q_495,What did Beyoncé announce in January 2010?,a hiatus from her music career,llama3-8b-8192
q_496,Who suggested the hiatus for Beyoncé?,Her mother,llama3-8b-8192
q_497,Who did Beyoncé part ways with during her hiatus?,Her father,llama3-8b-8192
q_498,How long did her hiatus last?,Nine months,llama3-8b-8192
q_499,In which year was reports about Beyonce performing for Muammar Gaddafi surface?,2011,llama3-8b-8192
q_5,When did the Scholastic Magazine of Notre dame begin publishing?,September 1876,llama3-8b-8192
q_50,What was the lifespan of John Augustine Zahm?,1851–1921,llama3-8b-8192
q_500,Who did Beyonce donate the money to earned from her shows?,The Clinton Bush Haiti Fund,llama3-8b-8192
q_501,Beyonce became the first female artist to perform solo in 20 years at which stage?,Glastonbury Festival,llama3-8b-8192
q_502,Which organization did Beyonce's spokespeople confirm her donations to?,The Clinton Bush Haiti Fund,llama3-8b-8192
q_503,Beyonce was listed in 2011 as the highest paid performer per what?,per minute,llama3-8b-8192
q_504,Hoe did everyone learn that Beyonce performed for Kaddafi?,UNKNOWN,llama3-8b-8192
q_506,Who did she tell about the donation?,The Huffington Post,llama3-8b-8192
q_507,Where did Beyonce perform in 2011?,"Libya, Glastonbury Festival, and MTV Video Music Awards",llama3-8b-8192
q_508,Who did Beyoncé perform privately for in 2011?,The family of Libyan ruler Muammar Gaddafi,llama3-8b-8192
q_509,Who released the information about Beyoncé's performance for the Libyan ruler?,WikiLeaks,llama3-8b-8192
q_51,What program did John Augustine Zahm come to co-direct at Nore Dame?,Science Department,llama3-8b-8192
q_510,Which organization did Beyoncé donate her pay for the private performance to?,The Clinton Bush Haiti Fund,llama3-8b-8192
q_511,Beyoncé was the first female singer to headline what at the 2011 Glastonbury Festival?,main Pyramid stage,llama3-8b-8192
q_512,Beyonce's fourth album debuted in what year?,2011,llama3-8b-8192
q_513,Which single had the most success from that album?,Single Ladies (Put a Ring on It),llama3-8b-8192
q_514,Beyonce won an award for which activity in 2011?,A writing award from the New York Association of Black Journalists,llama3-8b-8192
q_515,"in 2011, Beyonce performed for four nights where?",Revel Atlantic City's Ovation Hall and New York's Roseland Ballroom,llama3-8b-8192
q_516,When was Beyonce's forth album released?,UNKNOWN,llama3-8b-8192
q_517,How many copies did the album sell in its first week?,"317,000",llama3-8b-8192
q_518,Who awarded Beyonce and award for writing?,"American Society of Composers, Authors, and Publishers",llama3-8b-8192
q_519,When did she perform at the Roseland ballroom?,Late 2011,llama3-8b-8192
q_52,What book did John Zahm write in 1896?,Evolution and Dogma,llama3-8b-8192
q_520,What is the name of Beyoncé's fourth studio album?,4,llama3-8b-8192
q_521,When was 4 released?,"June 28, 2011",llama3-8b-8192
q_522,How many copies of 4 sold in the first week?,"310,000",llama3-8b-8192
q_523,What magazine did Beyoncé write a story for about her earlier hiatus?,Essence,llama3-8b-8192
q_524,Where did Beyoncé perform for four nights of standing room only concerts in 2011?,New York's Roseland Ballroom,llama3-8b-8192
q_525,When did Beyonce have her first child?,"January 7, 2012",llama3-8b-8192
q_526,Where did Beyonce give birth to her first child?,Lenox Hill Hospital in New York,llama3-8b-8192
q_527,Beyonce's first child is named what?,Blue Ivy Carter,llama3-8b-8192
q_528,Her first appearance performing since giving birth was where?,Revel Atlantic City's Ovation Hall,llama3-8b-8192
q_529,When did Beyonce have her first child?,"January 7, 2012",llama3-8b-8192
q_53,What professorship did Father Josh Carrier hold at Notre Dame?,Professor of Chemistry and Physics,llama3-8b-8192
q_530,What was the child's name?,Beyoncé Giselle Knowles,llama3-8b-8192
q_531,How long was it after the birth of her child before she performed again?,Five months,llama3-8b-8192
q_532,How many nights did she perform at Atlantic City?,Four nights,llama3-8b-8192
q_533,When did Beyoncé give birth to a daughter?,"January 7, 2012",llama3-8b-8192
q_534,What did Beyoncé name her daughter?,Blue Ivy Carter,llama3-8b-8192
q_535,Where was Blue Ivy born?,Lenox Hill Hospital in New York,llama3-8b-8192
q_536,Where was Beyoncé's first public performance after giving birth?,Revel Atlantic City's Ovation Hall,llama3-8b-8192
q_537,How many nights did Beyoncé play at the resort?,Four nights,llama3-8b-8192
q_538,Destiny's Child released a compilation album about which topic?,Number 1's,llama3-8b-8192
q_539,Beyonce's documentary movie was called what?,UNKNOWN,llama3-8b-8192
q_54,In what year did Albert Zahm begin comparing aeronatical models at Notre Dame?,1882,llama3-8b-8192
q_540,What did Beyonce sign in 2013?,A global publishing agreement with Warner/Chappell Music,llama3-8b-8192
q_541,"When did Destiny's Child release its album ""Love Songs""?",January 2013,llama3-8b-8192
q_542,What was the title of the added track in Love Songs?,Nuclear,llama3-8b-8192
q_543,At whose inauguration did she perform the National Anthem?,President Barack Obama's,llama3-8b-8192
q_544,How many Tweets per minute did the half time show get?,"268,000",llama3-8b-8192
q_545,When did Destiny's Child release Love Songs?,January 2013,llama3-8b-8192
q_546,What was the new track for Love Songs?,Nuclear,llama3-8b-8192
q_547,What did Beyoncé sing at President Obama's second inauguration?,"The American national anthem, singing along with a pre-recorded track",llama3-8b-8192
q_548,What event did Beyoncé perform at one month after Obama's inauguration?,The Neighborhood Ball,llama3-8b-8192
q_549,What is the name of Beyoncé's documentary film?,Life Is But a Dream,llama3-8b-8192
q_55,Which professor sent the first wireless message in the USA?,Professor Jerome Green,llama3-8b-8192
q_550,"How many dates did Beyonce's ""The Mrs. Carter Show"" entail?",132,llama3-8b-8192
q_551,One of Beyonce's most successful tours yet was which one?,The Mrs,llama3-8b-8192
q_552,"Beyonce wrote which song for the movie ""Epic""?",Rise Up,llama3-8b-8192
q_553,Beyonce voiced a character in which animated film?,Epic,llama3-8b-8192
q_554,When did the tour begin?,April 15,llama3-8b-8192
q_555,Of what event was Beyonce honorary chair?,2013 Met Gala,llama3-8b-8192
q_556,What part did she voice for the movie Epic?,Queen Tara,llama3-8b-8192
q_557,What song did Beyonce record for the film Epic?,Rise Up,llama3-8b-8192
q_558,What was the name of Beyoncé's tour that she started on April 15?,The Mrs,llama3-8b-8192
q_559,How many dates did the Mrs. Carter Show World Tour have?,132,llama3-8b-8192
q_56,In what year did Jerome Green send his first wireless message?,1899,llama3-8b-8192
q_560,Which Amy Winehouse song did Beyoncé cover and release in May 2014?,Back to Black,llama3-8b-8192
q_561,Beyoncé was an honorary chair of the 2013 what?,Met Gala,llama3-8b-8192
q_562,"Which character in the film, Epic, was voiced by Beyoncé?",UNKNOWN,llama3-8b-8192
q_563,Where did Beyonce release her 5th album to a huge surprise?,UNKNOWN,llama3-8b-8192
q_564,When did Beyonce get her fifth consecutive number one hit album?,"December 13, 2013",llama3-8b-8192
q_565,Where was the album released?,"June 24, 2003",llama3-8b-8192
q_566,Who joined Beyonce on her On The Run Tour?,Jay Z,llama3-8b-8192
q_567,Who reported Beyonce to e the top earning woman in music?,Forbes,llama3-8b-8192
q_568,How much more were her earnings that the year before?,$115 million,llama3-8b-8192
q_569,When did Beyoncé release her fifth studio album?,"December 13, 2013",llama3-8b-8192
q_57,Which individual worked on projects at Notre Dame that eventually created neoprene?,Father Julius Nieuwland,llama3-8b-8192
q_570,How many digital copies of her fifth album did Beyoncé sell in six days?,One million,llama3-8b-8192
q_571,What song on Beyoncé's fifth studio album featured her husband?,Drunk in Love,llama3-8b-8192
q_572,What was the name of the tour featuring both Beyoncé and Jay Z?,On the Run Tour,llama3-8b-8192
q_573,How many awards did Beyonce take home with her at the 57th Grammy Awards?,Three,llama3-8b-8192
q_574,Which artist beat Beyonce out for Album of the year?,UNKNOWN,llama3-8b-8192
q_575,Which magazine did Beyonce pose on the cover for in August of 2015?,Vogue,llama3-8b-8192
